{
	"schemaVersion": "equipment-image-result-v2",
	"resultId": "result-material-equipment-v2-bronze-spear-v2",
	"targetId": "material-equipment-v2-bronze-spear-v2",
	"assignmentId": "assignment-material-equipment-v2-bronze-spear-v2",
	"status": "revise",
	"humanReviewLabel": "Check",
	"promptSha256": "6fb617969807cb32c57f466071026d43d6ce18b5a3ec411b2b0c349be858f89c",
	"referenceInputs": [
		{
			"referenceId": "remy-finish-style",
			"path": "assets/heroes/visuals/forge-v2/benchmarks/remy-esen-equipped-v1.png",
			"contentHash": "9c726ad578a6a6d8ed510a7e7117443ce471e553d233b36a8c20afedddd1040d"
		},
		{
			"referenceId": "spear-pose",
			"path": "assets/equipment/experiments/material-equipment-v1/candidates/e/iron/spear-v1.png",
			"contentHash": "15e1d942b8760bb269a4a70074008a7be2999636c354fb802f15bd962a99f6b6"
		}
	],
	"attempts": [
		{
			"attemptId": "attempt-material-equipment-v2-bronze-spear-v2",
			"attemptNumber": 1,
			"sourceOutputId": "imagegen:exec-ed971f4a-a2b1-4c10-8ee8-a5c2542c0ea1",
			"requestStartedAt": "2026-09-02T22:19:23.864Z",
			"generationCompletedAt": "2026-09-02T22:20:05.959Z",
			"inspectionCompletedAt": "2026-09-02T22:20:32.493Z"
		}
	],
	"findings": [
		{
			"criterionId": "v2-framing",
			"outcome": "concern",
			"observation": "Producer inspection found a concern requiring human review."
		},
		{
			"criterionId": "expected-object-component-count",
			"outcome": "pass",
			"observation": "Producer inspection passed this declared criterion."
		},
		{
			"criterionId": "equipment-class-silhouette",
			"outcome": "pass",
			"observation": "Producer inspection passed this declared criterion."
		},
		{
			"criterionId": "class-pose-lock",
			"outcome": "pass",
			"observation": "Producer inspection passed this declared criterion."
		},
		{
			"criterionId": "structural-plausibility",
			"outcome": "pass",
			"observation": "Producer inspection passed this declared criterion."
		},
		{
			"criterionId": "rank-bearing-material-dominance",
			"outcome": "pass",
			"observation": "Producer inspection passed this declared criterion."
		},
		{
			"criterionId": "material-cue-strength",
			"outcome": "pass",
			"observation": "Producer inspection passed this declared criterion."
		},
		{
			"criterionId": "bounded-rank-behaviour",
			"outcome": "pass",
			"observation": "Producer inspection passed this declared criterion."
		},
		{
			"criterionId": "profile-style-cohesion",
			"outcome": "pass",
			"observation": "Producer inspection passed this declared criterion."
		},
		{
			"criterionId": "negative-constraint-safety",
			"outcome": "pass",
			"observation": "Producer inspection passed this declared criterion."
		}
	],
	"candidate": {
		"path": "assets/equipment/experiments/material-equipment-v2/candidates/f/bronze/spear-v2.png",
		"mediaType": "image/png",
		"width": 1024,
		"height": 1024,
		"bytes": 1176322,
		"sha256": "c797e068a39fee7b1820ade1a88a670d1210b35cb0d81beec9731638a86bea9a"
	},
	"candidateSha256": "c797e068a39fee7b1820ade1a88a670d1210b35cb0d81beec9731638a86bea9a",
	"startedAt": "2026-09-02T22:19:23.864Z",
	"completedAt": "2026-09-02T22:20:32.493Z",
	"writtenOutputPaths": [
		"assets/equipment/experiments/material-equipment-v2/candidates/f/bronze/spear-v2.png",
		"assets/equipment/experiments/material-equipment-v2/results/f/bronze/spear-v2.json"
	],
	"noSharedFilesEdited": true,
	"selfPromoted": false
}
