{
	"schemaVersion": "equipment-image-result-v2",
	"resultId": "result-material-equipment-v2-hard-leather-light-armour-full-set-v2",
	"targetId": "material-equipment-v2-hard-leather-light-armour-full-set-v2",
	"assignmentId": "assignment-material-equipment-v2-hard-leather-light-armour-full-set-v2",
	"status": "revise",
	"humanReviewLabel": "Check",
	"promptSha256": "1e0591b11ccc612dcecd7a838e724b014debb78168d3fa5a45606c3a5271a6a7",
	"referenceInputs": [
		{
			"referenceId": "remy-finish-style",
			"path": "assets/heroes/visuals/forge-v2/benchmarks/remy-esen-equipped-v1.png",
			"contentHash": "9c726ad578a6a6d8ed510a7e7117443ce471e553d233b36a8c20afedddd1040d"
		},
		{
			"referenceId": "coarse-hide-armour-camera",
			"path": "assets/equipment/experiments/material-equipment-v1/candidates/f/coarse-hide/light-armour-full-set-v1.png",
			"contentHash": "b3b973ffa5eec4fb7f0125202b16b845cd271feec5c5d1351ebd55bfb7fef247"
		}
	],
	"attempts": [
		{
			"attemptId": "attempt-material-equipment-v2-hard-leather-light-armour-full-set-v2",
			"attemptNumber": 1,
			"sourceOutputId": "exec-bd76fbd6-6bfe-49f2-91b5-be93adff1d8e",
			"requestStartedAt": "2026-09-02T22:22:57.338Z",
			"generationCompletedAt": "2026-09-02T22:23:38.875Z",
			"inspectionCompletedAt": "2026-09-02T22:24:34.933Z"
		}
	],
	"findings": [
		{
			"criterionId": "v2-framing",
			"outcome": "pass",
			"observation": "Producer inspection passed this declared criterion."
		},
		{
			"criterionId": "expected-object-component-count",
			"outcome": "pass",
			"observation": "Producer inspection passed this declared criterion."
		},
		{
			"criterionId": "equipment-class-silhouette",
			"outcome": "concern",
			"observation": "Producer inspection found a concern requiring human review."
		},
		{
			"criterionId": "class-pose-lock",
			"outcome": "pass",
			"observation": "Producer inspection passed this declared criterion."
		},
		{
			"criterionId": "structural-plausibility",
			"outcome": "pass",
			"observation": "Producer inspection passed this declared criterion."
		},
		{
			"criterionId": "rank-bearing-material-dominance",
			"outcome": "pass",
			"observation": "Producer inspection passed this declared criterion."
		},
		{
			"criterionId": "material-cue-strength",
			"outcome": "pass",
			"observation": "Producer inspection passed this declared criterion."
		},
		{
			"criterionId": "bounded-rank-behaviour",
			"outcome": "pass",
			"observation": "Producer inspection passed this declared criterion."
		},
		{
			"criterionId": "profile-style-cohesion",
			"outcome": "pass",
			"observation": "Producer inspection passed this declared criterion."
		},
		{
			"criterionId": "negative-constraint-safety",
			"outcome": "pass",
			"observation": "Producer inspection passed this declared criterion."
		},
		{
			"criterionId": "empty-full-set",
			"outcome": "pass",
			"observation": "Producer inspection passed this declared criterion."
		}
	],
	"candidate": {
		"path": "assets/equipment/experiments/material-equipment-v2/candidates/e/hard-leather/light-armour-full-set-v2.png",
		"mediaType": "image/png",
		"width": 1024,
		"height": 1536,
		"bytes": 2011030,
		"sha256": "bb59cec82269dc8cc8fd9dbee5d6a15266c9748492eee35576443ab621cee259"
	},
	"candidateSha256": "bb59cec82269dc8cc8fd9dbee5d6a15266c9748492eee35576443ab621cee259",
	"startedAt": "2026-09-02T22:22:57.338Z",
	"completedAt": "2026-09-02T22:24:34.933Z",
	"writtenOutputPaths": [
		"assets/equipment/experiments/material-equipment-v2/candidates/e/hard-leather/light-armour-full-set-v2.png",
		"assets/equipment/experiments/material-equipment-v2/results/e/hard-leather/light-armour-full-set-v2.json"
	],
	"noSharedFilesEdited": true,
	"selfPromoted": false
}
